<?xml version="1.0" encoding="utf-8"?>
<?xml-stylesheet type="text/xsl" href="pdml2html.xsl"?>
<!-- You can find pdml2html.xsl in /usr/share/wireshark or at https://code.wireshark.org/review/gitweb?p=wireshark.git;a=blob_plain;f=pdml2html.xsl. -->
<pdml version="0" creator="wireshark/2.6.8" time="Sat Sep  7 17:12:35 2019" capture_file="/root/Desktop/Protocol-Dissector-Builder/Backend/PCAP/pcapTest.pcap">
<packet>
  <proto name="geninfo" pos="0" showname="General information" size="42">
    <field name="num" pos="0" show="1" showname="Number" value="1" size="42"/>
    <field name="len" pos="0" show="42" showname="Frame Length" value="2a" size="42"/>
    <field name="caplen" pos="0" show="42" showname="Captured Length" value="2a" size="42"/>
    <field name="timestamp" pos="0" show="Jan 23, 2015 14:13:56.000000000 MST" showname="Captured Time" value="1422047636.000000000" size="42"/>
  </proto>
  <proto name="frame" showname="Frame 1: 42 bytes on wire (336 bits), 42 bytes captured (336 bits)" size="42" pos="0">
    <field name="frame.encap_type" showname="Encapsulation type: Raw IP (7)" size="0" pos="0" show="7"/>
    <field name="frame.time" showname="Arrival Time: Jan 23, 2015 14:13:56.000000000 MST" size="0" pos="0" show="Jan 23, 2015 14:13:56.000000000 MST"/>
    <field name="frame.offset_shift" showname="Time shift for this packet: 0.000000000 seconds" size="0" pos="0" show="0.000000000"/>
    <field name="frame.time_epoch" showname="Epoch Time: 1422047636.000000000 seconds" size="0" pos="0" show="1422047636.000000000"/>
    <field name="frame.time_delta" showname="Time delta from previous captured frame: 0.000000000 seconds" size="0" pos="0" show="0.000000000"/>
    <field name="frame.time_delta_displayed" showname="Time delta from previous displayed frame: 0.000000000 seconds" size="0" pos="0" show="0.000000000"/>
    <field name="frame.time_relative" showname="Time since reference or first frame: 0.000000000 seconds" size="0" pos="0" show="0.000000000"/>
    <field name="frame.number" showname="Frame Number: 1" size="0" pos="0" show="1"/>
    <field name="frame.len" showname="Frame Length: 42 bytes (336 bits)" size="0" pos="0" show="42"/>
    <field name="frame.cap_len" showname="Capture Length: 42 bytes (336 bits)" size="0" pos="0" show="42"/>
    <field name="frame.marked" showname="Frame is marked: False" size="0" pos="0" show="0"/>
    <field name="frame.ignored" showname="Frame is ignored: False" size="0" pos="0" show="0"/>
    <field name="frame.protocols" showname="Protocols in frame: raw:ip:tcp:data" size="0" pos="0" show="raw:ip:tcp:data"/>
  </proto>
  <proto name="raw" showname="Raw packet data" size="42" pos="0"/>
  <proto name="ip" showname="Internet Protocol Version 4, Src: 127.0.0.1, Dst: 127.0.0.1" size="20" pos="0">
    <field name="ip.version" showname="0100 .... = Version: 4" size="1" pos="0" show="4" value="4" unmaskedvalue="45"/>
    <field name="ip.hdr_len" showname=".... 0101 = Header Length: 20 bytes (5)" size="1" pos="0" show="20" value="45"/>
    <field name="ip.dsfield" showname="Differentiated Services Field: 0x00 (DSCP: CS0, ECN: Not-ECT)" size="1" pos="1" show="0x00000000" value="00">
      <field name="ip.dsfield.dscp" showname="0000 00.. = Differentiated Services Codepoint: Default (0)" size="1" pos="1" show="0" value="0" unmaskedvalue="00"/>
      <field name="ip.dsfield.ecn" showname=".... ..00 = Explicit Congestion Notification: Not ECN-Capable Transport (0)" size="1" pos="1" show="0" value="0" unmaskedvalue="00"/>
    </field>
    <field name="ip.len" showname="Total Length: 42" size="2" pos="2" show="42" value="002a"/>
    <field name="ip.id" showname="Identification: 0x0002 (2)" size="2" pos="4" show="0x00000002" value="0002"/>
    <field name="ip.flags" showname="Flags: 0x0000" size="2" pos="6" show="0x00000000" value="0000">
      <field name="ip.flags.rb" showname="0... .... .... .... = Reserved bit: Not set" size="2" pos="6" show="0" value="0" unmaskedvalue="0000"/>
      <field name="ip.flags.df" showname=".0.. .... .... .... = Don&#x27;t fragment: Not set" size="2" pos="6" show="0" value="0" unmaskedvalue="0000"/>
      <field name="ip.flags.mf" showname="..0. .... .... .... = More fragments: Not set" size="2" pos="6" show="0" value="0" unmaskedvalue="0000"/>
      <field name="ip.frag_offset" showname="...0 0000 0000 0000 = Fragment offset: 0" size="2" pos="6" show="0" value="0" unmaskedvalue="0000"/>
    </field>
    <field name="ip.ttl" showname="Time to live: 64" size="1" pos="8" show="64" value="40"/>
    <field name="ip.proto" showname="Protocol: TCP (6)" size="1" pos="9" show="6" value="06"/>
    <field name="ip.checksum" showname="Header checksum: 0x7cca [validation disabled]" size="2" pos="10" show="0x00007cca" value="7cca"/>
    <field name="ip.checksum.status" showname="Header checksum status: Unverified" size="0" pos="10" show="2"/>
    <field name="ip.src" showname="Source: 127.0.0.1" size="4" pos="12" show="127.0.0.1" value="7f000001"/>
    <field name="ip.addr" showname="Source or Destination Address: 127.0.0.1" hide="yes" size="4" pos="12" show="127.0.0.1" value="7f000001"/>
    <field name="ip.src_host" showname="Source Host: 127.0.0.1" hide="yes" size="4" pos="12" show="127.0.0.1" value="7f000001"/>
    <field name="ip.host" showname="Source or Destination Host: 127.0.0.1" hide="yes" size="4" pos="12" show="127.0.0.1" value="7f000001"/>
    <field name="ip.dst" showname="Destination: 127.0.0.1" size="4" pos="16" show="127.0.0.1" value="7f000001"/>
    <field name="ip.addr" showname="Source or Destination Address: 127.0.0.1" hide="yes" size="4" pos="16" show="127.0.0.1" value="7f000001"/>
    <field name="ip.dst_host" showname="Destination Host: 127.0.0.1" hide="yes" size="4" pos="16" show="127.0.0.1" value="7f000001"/>
    <field name="ip.host" showname="Source or Destination Host: 127.0.0.1" hide="yes" size="4" pos="16" show="127.0.0.1" value="7f000001"/>
  </proto>
  <proto name="tcp" showname="Transmission Control Protocol, Src Port: 56261, Dst Port: 2620, Seq: 1, Ack: 1, Len: 2" size="20" pos="20">
    <field name="tcp.srcport" showname="Source Port: 56261" size="2" pos="20" show="56261" value="dbc5"/>
    <field name="tcp.dstport" showname="Destination Port: 2620" size="2" pos="22" show="2620" value="0a3c"/>
    <field name="tcp.port" showname="Source or Destination Port: 56261" hide="yes" size="2" pos="20" show="56261" value="dbc5"/>
    <field name="tcp.port" showname="Source or Destination Port: 2620" hide="yes" size="2" pos="22" show="2620" value="0a3c"/>
    <field name="tcp.stream" showname="Stream index: 0" size="0" pos="20" show="0"/>
    <field name="tcp.len" showname="TCP Segment Len: 2" size="1" pos="32" show="2" value="50"/>
    <field name="tcp.seq" showname="Sequence number: 1    (relative sequence number)" size="4" pos="24" show="1" value="00000001"/>
    <field name="tcp.nxtseq" showname="Next sequence number: 3    (relative sequence number)" size="0" pos="20" show="3"/>
    <field name="tcp.ack" showname="Acknowledgment number: 1    (relative ack number)" size="4" pos="28" show="1" value="00000001"/>
    <field name="tcp.hdr_len" showname="0101 .... = Header Length: 20 bytes (5)" size="1" pos="32" show="20" value="50"/>
    <field name="tcp.flags" showname="Flags: 0x010 (ACK)" size="2" pos="32" show="0x00000010" value="10" unmaskedvalue="5010">
      <field name="tcp.flags.res" showname="000. .... .... = Reserved: Not set" size="1" pos="32" show="0" value="0" unmaskedvalue="50"/>
      <field name="tcp.flags.ns" showname="...0 .... .... = Nonce: Not set" size="1" pos="32" show="0" value="0" unmaskedvalue="50"/>
      <field name="tcp.flags.cwr" showname=".... 0... .... = Congestion Window Reduced (CWR): Not set" size="1" pos="33" show="0" value="0" unmaskedvalue="10"/>
      <field name="tcp.flags.ecn" showname=".... .0.. .... = ECN-Echo: Not set" size="1" pos="33" show="0" value="0" unmaskedvalue="10"/>
      <field name="tcp.flags.urg" showname=".... ..0. .... = Urgent: Not set" size="1" pos="33" show="0" value="0" unmaskedvalue="10"/>
      <field name="tcp.flags.ack" showname=".... ...1 .... = Acknowledgment: Set" size="1" pos="33" show="1" value="1" unmaskedvalue="10"/>
      <field name="tcp.flags.push" showname=".... .... 0... = Push: Not set" size="1" pos="33" show="0" value="0" unmaskedvalue="10"/>
      <field name="tcp.flags.reset" showname=".... .... .0.. = Reset: Not set" size="1" pos="33" show="0" value="0" unmaskedvalue="10"/>
      <field name="tcp.flags.syn" showname=".... .... ..0. = Syn: Not set" size="1" pos="33" show="0" value="0" unmaskedvalue="10"/>
      <field name="tcp.flags.fin" showname=".... .... ...0 = Fin: Not set" size="1" pos="33" show="0" value="0" unmaskedvalue="10"/>
      <field name="tcp.flags.str" showname="TCP Flags: \xc2\xb7\xc2\xb7\xc2\xb7\xc2\xb7\xc2\xb7\xc2\xb7\xc2\xb7A\xc2\xb7\xc2\xb7\xc2\xb7\xc2\xb7" size="2" pos="32" show="\xc2\xb7\xc2\xb7\xc2\xb7\xc2\xb7\xc2\xb7\xc2\xb7\xc2\xb7A\xc2\xb7\xc2\xb7\xc2\xb7\xc2\xb7" value="5010"/>
    </field>
    <field name="tcp.window_size_value" showname="Window size value: 65535" size="2" pos="34" show="65535" value="ffff"/>
    <field name="tcp.window_size" showname="Calculated window size: 65535" size="2" pos="34" show="65535" value="ffff"/>
    <field name="tcp.window_size_scalefactor" showname="Window size scaling factor: -1 (unknown)" size="2" pos="34" show="-1" value="ffff"/>
    <field name="tcp.checksum" showname="Checksum: 0xc8ea [unverified]" size="2" pos="36" show="0x0000c8ea" value="c8ea"/>
    <field name="tcp.checksum.status" showname="Checksum Status: Unverified" size="0" pos="36" show="2"/>
    <field name="tcp.urgent_pointer" showname="Urgent pointer: 0" size="2" pos="38" show="0" value="0000"/>
    <field name="tcp.analysis" showname="SEQ/ACK analysis" size="0" pos="20" show="" value="">
      <field name="tcp.analysis.bytes_in_flight" showname="Bytes in flight: 2" size="0" pos="20" show="2"/>
      <field name="tcp.analysis.push_bytes_sent" showname="Bytes sent since last PSH flag: 2" size="0" pos="20" show="2"/>
    </field>
    <field name="" show="Timestamps" size="0" pos="20">
      <field name="tcp.time_relative" showname="Time since first frame in this TCP stream: 0.000000000 seconds" size="0" pos="20" show="0.000000000"/>
      <field name="tcp.time_delta" showname="Time since previous frame in this TCP stream: 0.000000000 seconds" size="0" pos="20" show="0.000000000"/>
    </field>
    <field name="tcp.payload" showname="TCP payload (2 bytes)" size="2" pos="40" show="01:01" value="0101"/>
  </proto>
  <proto name="fake-field-wrapper">
    <field name="data" value="0101">
      <field name="data.data" showname="Data: 0101" size="2" pos="40" show="01:01" value="0101"/>
      <field name="data.len" showname="Length: 2" size="0" pos="40" show="2"/>
  </field>
  </proto>
</packet>


<packet>
  <proto name="geninfo" pos="0" showname="General information" size="4134">
    <field name="num" pos="0" show="2" showname="Number" value="2" size="4134"/>
    <field name="len" pos="0" show="4134" showname="Frame Length" value="1026" size="4134"/>
    <field name="caplen" pos="0" show="4134" showname="Captured Length" value="1026" size="4134"/>
    <field name="timestamp" pos="0" show="Jan 23, 2015 14:13:56.000000000 MST" showname="Captured Time" value="1422047636.000000000" size="4134"/>
  </proto>
  <proto name="frame" showname="Frame 2: 4134 bytes on wire (33072 bits), 4134 bytes captured (33072 bits)" size="4134" pos="0">
    <field name="frame.encap_type" showname="Encapsulation type: Raw IP (7)" size="0" pos="0" show="7"/>
    <field name="frame.time" showname="Arrival Time: Jan 23, 2015 14:13:56.000000000 MST" size="0" pos="0" show="Jan 23, 2015 14:13:56.000000000 MST"/>
    <field name="frame.offset_shift" showname="Time shift for this packet: 0.000000000 seconds" size="0" pos="0" show="0.000000000"/>
    <field name="frame.time_epoch" showname="Epoch Time: 1422047636.000000000 seconds" size="0" pos="0" show="1422047636.000000000"/>
    <field name="frame.time_delta" showname="Time delta from previous captured frame: 0.000000000 seconds" size="0" pos="0" show="0.000000000"/>
    <field name="frame.time_delta_displayed" showname="Time delta from previous displayed frame: 0.000000000 seconds" size="0" pos="0" show="0.000000000"/>
    <field name="frame.time_relative" showname="Time since reference or first frame: 0.000000000 seconds" size="0" pos="0" show="0.000000000"/>
    <field name="frame.number" showname="Frame Number: 2" size="0" pos="0" show="2"/>
    <field name="frame.len" showname="Frame Length: 4134 bytes (33072 bits)" size="0" pos="0" show="4134"/>
    <field name="frame.cap_len" showname="Capture Length: 4134 bytes (33072 bits)" size="0" pos="0" show="4134"/>
    <field name="frame.marked" showname="Frame is marked: False" size="0" pos="0" show="0"/>
    <field name="frame.ignored" showname="Frame is ignored: False" size="0" pos="0" show="0"/>
    <field name="frame.protocols" showname="Protocols in frame: raw:ip:tcp:data" size="0" pos="0" show="raw:ip:tcp:data"/>
  </proto>
  <proto name="raw" showname="Raw packet data" size="4134" pos="0"/>
  <proto name="ip" showname="Internet Protocol Version 4, Src: 127.0.0.1, Dst: 127.0.0.1" size="20" pos="0">
    <field name="ip.version" showname="0100 .... = Version: 4" size="1" pos="0" show="4" value="4" unmaskedvalue="45"/>
    <field name="ip.hdr_len" showname=".... 0101 = Header Length: 20 bytes (5)" size="1" pos="0" show="20" value="45"/>
    <field name="ip.dsfield" showname="Differentiated Services Field: 0x00 (DSCP: CS0, ECN: Not-ECT)" size="1" pos="1" show="0x00000000" value="00">
      <field name="ip.dsfield.dscp" showname="0000 00.. = Differentiated Services Codepoint: Default (0)" size="1" pos="1" show="0" value="0" unmaskedvalue="00"/>
      <field name="ip.dsfield.ecn" showname=".... ..00 = Explicit Congestion Notification: Not ECN-Capable Transport (0)" size="1" pos="1" show="0" value="0" unmaskedvalue="00"/>
    </field>
    <field name="ip.len" showname="Total Length: 4134" size="2" pos="2" show="4134" value="1026"/>
    <field name="ip.id" showname="Identification: 0x0004 (4)" size="2" pos="4" show="0x00000004" value="0004"/>
    <field name="ip.flags" showname="Flags: 0x0000" size="2" pos="6" show="0x00000000" value="0000">
      <field name="ip.flags.rb" showname="0... .... .... .... = Reserved bit: Not set" size="2" pos="6" show="0" value="0" unmaskedvalue="0000"/>
      <field name="ip.flags.df" showname=".0.. .... .... .... = Don&#x27;t fragment: Not set" size="2" pos="6" show="0" value="0" unmaskedvalue="0000"/>
      <field name="ip.flags.mf" showname="..0. .... .... .... = More fragments: Not set" size="2" pos="6" show="0" value="0" unmaskedvalue="0000"/>
      <field name="ip.frag_offset" showname="...0 0000 0000 0000 = Fragment offset: 0" size="2" pos="6" show="0" value="0" unmaskedvalue="0000"/>
    </field>
    <field name="ip.ttl" showname="Time to live: 64" size="1" pos="8" show="64" value="40"/>
    <field name="ip.proto" showname="Protocol: TCP (6)" size="1" pos="9" show="6" value="06"/>
    <field name="ip.checksum" showname="Header checksum: 0x6ccc [validation disabled]" size="2" pos="10" show="0x00006ccc" value="6ccc"/>
    <field name="ip.checksum.status" showname="Header checksum status: Unverified" size="0" pos="10" show="2"/>
    <field name="ip.src" showname="Source: 127.0.0.1" size="4" pos="12" show="127.0.0.1" value="7f000001"/>
    <field name="ip.addr" showname="Source or Destination Address: 127.0.0.1" hide="yes" size="4" pos="12" show="127.0.0.1" value="7f000001"/>
    <field name="ip.src_host" showname="Source Host: 127.0.0.1" hide="yes" size="4" pos="12" show="127.0.0.1" value="7f000001"/>
    <field name="ip.host" showname="Source or Destination Host: 127.0.0.1" hide="yes" size="4" pos="12" show="127.0.0.1" value="7f000001"/>
    <field name="ip.dst" showname="Destination: 127.0.0.1" size="4" pos="16" show="127.0.0.1" value="7f000001"/>
    <field name="ip.addr" showname="Source or Destination Address: 127.0.0.1" hide="yes" size="4" pos="16" show="127.0.0.1" value="7f000001"/>
    <field name="ip.dst_host" showname="Destination Host: 127.0.0.1" hide="yes" size="4" pos="16" show="127.0.0.1" value="7f000001"/>
    <field name="ip.host" showname="Source or Destination Host: 127.0.0.1" hide="yes" size="4" pos="16" show="127.0.0.1" value="7f000001"/>
  </proto>
  <proto name="tcp" showname="Transmission Control Protocol, Src Port: 56261, Dst Port: 2620, Seq: 3, Ack: 1, Len: 4094" size="20" pos="20">
    <field name="tcp.srcport" showname="Source Port: 56261" size="2" pos="20" show="56261" value="dbc5"/>
    <field name="tcp.dstport" showname="Destination Port: 2620" size="2" pos="22" show="2620" value="0a3c"/>
    <field name="tcp.port" showname="Source or Destination Port: 56261" hide="yes" size="2" pos="20" show="56261" value="dbc5"/>
    <field name="tcp.port" showname="Source or Destination Port: 2620" hide="yes" size="2" pos="22" show="2620" value="0a3c"/>
    <field name="tcp.stream" showname="Stream index: 0" size="0" pos="20" show="0"/>
    <field name="tcp.len" showname="TCP Segment Len: 4094" size="1" pos="32" show="4094" value="50"/>
    <field name="tcp.seq" showname="Sequence number: 3    (relative sequence number)" size="4" pos="24" show="3" value="00000003"/>
    <field name="tcp.nxtseq" showname="Next sequence number: 4097    (relative sequence number)" size="0" pos="20" show="4097"/>
    <field name="tcp.ack" showname="Acknowledgment number: 1    (relative ack number)" size="4" pos="28" show="1" value="00000001"/>
    <field name="tcp.hdr_len" showname="0101 .... = Header Length: 20 bytes (5)" size="1" pos="32" show="20" value="50"/>
    <field name="tcp.flags" showname="Flags: 0x010 (ACK)" size="2" pos="32" show="0x00000010" value="10" unmaskedvalue="5010">
      <field name="tcp.flags.res" showname="000. .... .... = Reserved: Not set" size="1" pos="32" show="0" value="0" unmaskedvalue="50"/>
      <field name="tcp.flags.ns" showname="...0 .... .... = Nonce: Not set" size="1" pos="32" show="0" value="0" unmaskedvalue="50"/>
      <field name="tcp.flags.cwr" showname=".... 0... .... = Congestion Window Reduced (CWR): Not set" size="1" pos="33" show="0" value="0" unmaskedvalue="10"/>
      <field name="tcp.flags.ecn" showname=".... .0.. .... = ECN-Echo: Not set" size="1" pos="33" show="0" value="0" unmaskedvalue="10"/>
      <field name="tcp.flags.urg" showname=".... ..0. .... = Urgent: Not set" size="1" pos="33" show="0" value="0" unmaskedvalue="10"/>
      <field name="tcp.flags.ack" showname=".... ...1 .... = Acknowledgment: Set" size="1" pos="33" show="1" value="1" unmaskedvalue="10"/>
      <field name="tcp.flags.push" showname=".... .... 0... = Push: Not set" size="1" pos="33" show="0" value="0" unmaskedvalue="10"/>
      <field name="tcp.flags.reset" showname=".... .... .0.. = Reset: Not set" size="1" pos="33" show="0" value="0" unmaskedvalue="10"/>
      <field name="tcp.flags.syn" showname=".... .... ..0. = Syn: Not set" size="1" pos="33" show="0" value="0" unmaskedvalue="10"/>
      <field name="tcp.flags.fin" showname=".... .... ...0 = Fin: Not set" size="1" pos="33" show="0" value="0" unmaskedvalue="10"/>
      <field name="tcp.flags.str" showname="TCP Flags: \xc2\xb7\xc2\xb7\xc2\xb7\xc2\xb7\xc2\xb7\xc2\xb7\xc2\xb7A\xc2\xb7\xc2\xb7\xc2\xb7\xc2\xb7" size="2" pos="32" show="\xc2\xb7\xc2\xb7\xc2\xb7\xc2\xb7\xc2\xb7\xc2\xb7\xc2\xb7A\xc2\xb7\xc2\xb7\xc2\xb7\xc2\xb7" value="5010"/>
    </field>
    <field name="tcp.window_size_value" showname="Window size value: 65535" size="2" pos="34" show="65535" value="ffff"/>
    <field name="tcp.window_size" showname="Calculated window size: 65535" size="2" pos="34" show="65535" value="ffff"/>
    <field name="tcp.window_size_scalefactor" showname="Window size scaling factor: -1 (unknown)" size="2" pos="34" show="-1" value="ffff"/>
    <field name="tcp.checksum" showname="Checksum: 0x369c [unverified]" size="2" pos="36" show="0x0000369c" value="369c"/>
    <field name="tcp.checksum.status" showname="Checksum Status: Unverified" size="0" pos="36" show="2"/>
    <field name="tcp.urgent_pointer" showname="Urgent pointer: 0" size="2" pos="38" show="0" value="0000"/>
    <field name="tcp.analysis" showname="SEQ/ACK analysis" size="0" pos="20" show="" value="">
      <field name="tcp.analysis.bytes_in_flight" showname="Bytes in flight: 4096" size="0" pos="20" show="4096"/>
      <field name="tcp.analysis.push_bytes_sent" showname="Bytes sent since last PSH flag: 4096" size="0" pos="20" show="4096"/>
    </field>
    <field name="" show="Timestamps" size="0" pos="20">
      <field name="tcp.time_relative" showname="Time since first frame in this TCP stream: 0.000000000 seconds" size="0" pos="20" show="0.000000000"/>
      <field name="tcp.time_delta" showname="Time since previous frame in this TCP stream: 0.000000000 seconds" size="0" pos="20" show="0.000000000"/>
    </field>
